{
  "$schema": "../schemas/devices.schema.json",
  "catalogVersion": "4.1.0",
  "updatedAt": "2026-08-24",
  "categoryLabels": { "dynamics": "動態", "gain": "增益", "amp-simulator": "音箱前級", "speaker-simulator": "箱體與空間" },
  "devices": [
    {
      "id": "cali76",
      "manufacturer": "Origin Effects",
      "model": "Cali76 FET Compressor",
      "category": "dynamics",
      "subtype": "fet-compressor",
      "primaryRole": "Clean 與 Low Gain 的動態、延音及平行壓縮",
      "placement": "chain",
      "sections": [
        { "id": "pedal", "label": "主控制", "description": "面板旋鈕；先用 IN 決定壓縮量，再用 OUT 對齊 Bypass 音量。" },
        { "id": "meter", "label": "Gain Reduction 目標" }
      ],
      "controls": [
        { "id": "bypass", "label": "Bypass", "section": "pedal", "type": "footswitch", "valueType": "enum", "options": ["off", "on"], "surface": "panel" },
        {
          "id": "input",
          "label": "IN",
          "section": "pedal",
          "type": "knob",
          "valueType": "clock",
          "surface": "panel",
          "direction": { "left": "較少 Gain Reduction", "right": "較多 Gain Reduction 與輸入推動" }
        },
        {
          "id": "output",
          "label": "OUT",
          "section": "pedal",
          "type": "knob",
          "valueType": "clock",
          "surface": "panel",
          "direction": { "left": "較低輸出", "right": "較高輸出" }
        },
        {
          "id": "dry",
          "label": "DRY",
          "section": "pedal",
          "type": "knob",
          "valueType": "clock",
          "surface": "panel",
          "direction": { "left": "較少乾訊號", "right": "較多乾訊號；約 14:00 為 Dry Unity" }
        },
        {
          "id": "ratio",
          "label": "RATIO",
          "section": "pedal",
          "type": "knob",
          "valueType": "number",
          "unit": ":1",
          "min": 4,
          "max": 20,
          "surface": "panel",
          "direction": { "left": "4:1，較自然", "right": "20:1，限制更強" }
        },
        {
          "id": "attack",
          "label": "ATTACK",
          "section": "pedal",
          "type": "knob",
          "valueType": "clock",
          "surface": "panel",
          "direction": { "left": "較慢，保留 Pick Attack", "right": "較快，起音更平" }
        },
        {
          "id": "release",
          "label": "RELEASE",
          "section": "pedal",
          "type": "knob",
          "valueType": "clock",
          "surface": "panel",
          "direction": { "left": "較慢恢復", "right": "較快恢復" }
        },
        { "id": "gr_peak", "label": "Peak Gain Reduction", "section": "meter", "type": "readout", "valueType": "number", "unit": "dB", "min": 0, "max": 28, "surface": "panel" }
      ],
      "appearance": { "widthUnits": 1.6, "heightUnits": 1.55, "body": "#5c5f63", "face": "#e8e4da", "note": "示意圖，非實機外觀；旋鈕角度取自目前音色的設定值。" }
    },
    {
      "id": "notadumble-v2",
      "manufacturer": "JHS Pedals",
      "model": "NOTADÜMBLË V2",
      "category": "gain",
      "subtype": "dual-preamp-overdrive",
      "primaryRole": "Clean always-on 基底與 Dumble-style Lead",
      "placement": "chain",
      "sections": [
        { "id": "internal", "label": "內部順序" },
        { "id": "clean", "label": "Clean Channel", "description": "Always-on 基底；Input 調厚薄，Output 調音量。" },
        { "id": "drive", "label": "Drive Channel", "description": "Lead Lift；不與 Ive 高 Gain 疊加。" },
        { "id": "target", "label": "衍生目標" }
      ],
      "controls": [
        { "id": "clean_bypass", "label": "Clean Channel", "section": "clean", "type": "footswitch", "valueType": "enum", "options": ["off", "on"], "surface": "panel" },
        { "id": "drive_bypass", "label": "Drive Channel", "section": "drive", "type": "footswitch", "valueType": "enum", "options": ["off", "on"], "surface": "panel" },
        { "id": "internal_order", "label": "Internal Order", "section": "internal", "type": "toggle", "valueType": "enum", "options": ["drive-into-clean", "clean-into-drive"], "surface": "panel" },
        {
          "id": "clean_input",
          "label": "Clean Input",
          "section": "clean",
          "type": "knob",
          "valueType": "clock",
          "surface": "panel",
          "direction": { "left": "較薄、精確", "right": "較圓、飽滿" }
        },
        {
          "id": "clean_output",
          "label": "Clean Output",
          "section": "clean",
          "type": "knob",
          "valueType": "clock",
          "surface": "panel",
          "direction": { "left": "較低輸出", "right": "較高輸出與後級推動" }
        },
        {
          "id": "drive",
          "label": "Drive",
          "section": "drive",
          "type": "knob",
          "valueType": "clock",
          "surface": "panel",
          "direction": { "left": "較低失真", "right": "較多失真與壓縮" }
        },
        {
          "id": "drive_volume",
          "label": "Drive Volume",
          "section": "drive",
          "type": "knob",
          "valueType": "clock",
          "surface": "panel",
          "direction": { "left": "較低 Lead 音量", "right": "較高 Lead 音量及後級推動" }
        },
        { "id": "drive_level_lift", "label": "Drive Level Lift", "section": "target", "type": "readout", "valueType": "number", "unit": "dB", "min": 0, "max": 12, "surface": "derived" },
        {
          "id": "eq",
          "label": "EQ",
          "section": "drive",
          "type": "knob",
          "valueType": "clock",
          "surface": "panel",
          "direction": { "left": "Low-pass 削除更多高頻", "right": "保留更多撥弦輪廓" }
        },
        {
          "id": "presence",
          "label": "Presence",
          "section": "drive",
          "type": "knob",
          "valueType": "clock",
          "surface": "panel",
          "direction": { "left": "較少上中頻與高頻", "right": "更多存在感" }
        }
      ],
      "appearance": { "widthUnits": 2, "heightUnits": 1.35, "body": "#6b5a3e", "face": "#f0e7d2", "note": "示意圖，非實機外觀；旋鈕角度取自目前音色的設定值。" }
    },
    {
      "id": "petla-ive",
      "manufacturer": "Petla",
      "model": "Ive",
      "category": "gain",
      "subtype": "mid-focused-overdrive-boost",
      "primaryRole": "日系 Low Gain 或 IR-D 前的 Tight Boost",
      "placement": "chain",
      "sections": [
        { "id": "pedal", "label": "主控制" }
      ],
      "controls": [
        { "id": "bypass", "label": "Bypass", "section": "pedal", "type": "footswitch", "valueType": "enum", "options": ["off", "on"], "surface": "panel" },
        {
          "id": "gain",
          "label": "Gain",
          "section": "pedal",
          "type": "knob",
          "valueType": "clock",
          "surface": "panel",
          "direction": { "left": "較少 Ive 失真", "right": "較多失真與壓縮" }
        },
        {
          "id": "volume",
          "label": "Volume",
          "section": "pedal",
          "type": "knob",
          "valueType": "clock",
          "surface": "panel",
          "direction": { "left": "較少後級推動", "right": "較多後級推動" }
        },
        {
          "id": "tone",
          "label": "Tone",
          "section": "pedal",
          "type": "knob",
          "valueType": "clock",
          "surface": "panel",
          "direction": { "left": "較暗、較柔", "right": "較亮、較清楚" }
        },
        {
          "id": "saturation_cut",
          "label": "Saturation Cut",
          "section": "pedal",
          "type": "knob",
          "valueType": "clock",
          "surface": "panel",
          "direction": { "left": "削中低頻、俐落緊實", "right": "肥、鬆、厚，壓縮與延音增加" }
        }
      ],
      "appearance": { "widthUnits": 1, "heightUnits": 1.6, "body": "#43474d", "face": "#e4e0d6", "note": "示意圖，非實機外觀；旋鈕角度取自目前音色的設定值。" }
    },
    {
      "id": "friedman-ir-d",
      "manufacturer": "Friedman Amplification",
      "model": "IR-D",
      "category": "amp-simulator",
      "subtype": "dual-tube-preamp-power-amp-simulator",
      "primaryRole": "主要 Amp 基底與 Rock／Metal 失真來源",
      "placement": "chain",
      "sections": [
        { "id": "global", "label": "通道選擇" },
        { "id": "ch1", "label": "Channel 1", "description": "Clean、Edge-of-breakup 與接受前級推動的基底。" },
        { "id": "ch2", "label": "Channel 2", "description": "Hard Rock 到日系 Metal。" },
        { "id": "power-amp", "label": "Power Amp Simulation" },
        { "id": "output", "label": "輸出與 Cab IR", "description": "Cab IR 必須 Bypass，Speaker 交給 OX Stomp。" }
      ],
      "controls": [
        { "id": "active_channel", "label": "Active Channel", "section": "global", "type": "footswitch", "valueType": "enum", "options": ["ch1", "ch2"], "surface": "panel" },
        { "id": "cab_ir", "label": "Cab IR", "section": "output", "type": "toggle", "valueType": "enum", "options": ["bypass", "enabled"], "surface": "software" },
        { "id": "power_amp_sim", "label": "Power Amp Simulation", "section": "output", "type": "toggle", "valueType": "enum", "options": ["off", "on"], "surface": "software" },
        { "id": "ch1.gain_structure", "label": "Ch.1 Gain Structure", "section": "ch1", "type": "toggle", "valueType": "enum", "options": ["low-headroom", "medium", "high-gain"], "surface": "panel" },
        { "id": "ch2.gain_structure", "label": "Ch.2 Gain Structure", "section": "ch2", "type": "toggle", "valueType": "enum", "options": ["low-headroom", "medium", "high-gain"], "surface": "panel" },
        { "id": "ch1.bright_tight", "label": "Ch.1 Bright/Tight", "section": "ch1", "type": "toggle", "valueType": "enum", "options": ["full-fat", "bright-tight"], "surface": "panel" },
        { "id": "ch2.bright_tight", "label": "Ch.2 Bright/Tight", "section": "ch2", "type": "toggle", "valueType": "enum", "options": ["full-fat", "bright-tight"], "surface": "panel" },
        { "id": "ch1.gain", "label": "Ch.1 Gain", "section": "ch1", "type": "knob", "valueType": "clock", "surface": "panel" },
        { "id": "ch1.bass", "label": "Ch.1 Bass", "section": "ch1", "type": "knob", "valueType": "clock", "surface": "panel" },
        { "id": "ch1.middle", "label": "Ch.1 Middle", "section": "ch1", "type": "knob", "valueType": "clock", "surface": "panel" },